{"$comment":"Canonical UTF-8 JSON with final LF; max 1000000 bytes. Runtime also enforces sorted uniqueness, real UTC times, aggregate cross-field counts, rational budgets, review lifetimes and evaluation-time ordering.","$id":"https://martin-beck.github.io/agent-workflow-quality/schemas/consumer-equivalence.schema.json","$schema":"https://json-schema.org/draft/2020-12/schema","additionalProperties":false,"properties":{"consumer_sha256":{"pattern":"^[0-9a-f]{64}$","type":"string"},"gates":{"items":{"additionalProperties":false,"properties":{"awq_definition_sha256":{"pattern":"^[0-9a-f]{64}$","type":"string"},"cases":{"items":{"additionalProperties":false,"properties":{"awq":{"enum":["pass","fail","error","skip"]},"expected":{"enum":["pass","fail"]},"native":{"enum":["pass","fail","error","skip"]},"sha256":{"pattern":"^[0-9a-f]{64}$","type":"string"}},"required":["awq","expected","native","sha256"],"type":"object"},"maxItems":2000,"minItems":1,"type":"array"},"false_positive_reviews":{"items":{"additionalProperties":false,"properties":{"category":{"enum":["configuration","format","tool-version","environment","policy","unknown"]},"count":{"maximum":1000000,"minimum":1,"type":"integer"},"remediation":{"enum":["align-policy","repair-adapter","repair-fixture","investigate"]},"review":{"additionalProperties":false,"properties":{"approval_sha256":{"pattern":"^[0-9a-f]{64}$","type":"string"},"created_at":{"pattern":"^[0-9]{4}-[0-9]{2}-[0-9]{2}T[0-9]{2}:[0-9]{2}:[0-9]{2}Z$","type":"string"},"expires_at":{"pattern":"^[0-9]{4}-[0-9]{2}-[0-9]{2}T[0-9]{2}:[0-9]{2}:[0-9]{2}Z$","type":"string"},"owner":{"pattern":"^OWNER-[A-Z0-9]{4,32}$","type":"string"},"reviewer":{"pattern":"^OWNER-[A-Z0-9]{4,32}$","type":"string"}},"required":["approval_sha256","created_at","expires_at","owner","reviewer"],"type":"object"}},"required":["category","count","remediation","review"],"type":"object"},"maxItems":6,"minItems":0,"type":"array"},"id":{"pattern":"^AWQ-[A-Z]+-[0-9]{3}$","type":"string"},"native_definition_sha256":{"pattern":"^[0-9a-f]{64}$","type":"string"},"observation":{"additionalProperties":false,"properties":{"days":{"items":{"additionalProperties":false,"properties":{"awq_ms":{"maximum":1000000000,"minimum":1,"type":"integer"},"counts":{"additionalProperties":false,"properties":{"both_fail":{"maximum":1000000,"minimum":0,"type":"integer"},"both_pass":{"maximum":1000000,"minimum":0,"type":"integer"},"false_negative":{"maximum":1000000,"minimum":0,"type":"integer"},"false_positive":{"maximum":1000000,"minimum":0,"type":"integer"},"inconclusive":{"maximum":1000000,"minimum":0,"type":"integer"}},"required":["both_fail","both_pass","false_negative","false_positive","inconclusive"],"type":"object"},"date":{"pattern":"^[0-9]{4}-[0-9]{2}-[0-9]{2}$","type":"string"},"flaky_runs":{"maximum":1000000,"minimum":0,"type":"integer"},"native_ms":{"maximum":1000000000,"minimum":1,"type":"integer"}},"required":["awq_ms","counts","date","flaky_runs","native_ms"],"type":"object"},"maxItems":366,"minItems":1,"type":"array"},"ended_at":{"pattern":"^[0-9]{4}-[0-9]{2}-[0-9]{2}T[0-9]{2}:[0-9]{2}:[0-9]{2}Z$","type":"string"},"started_at":{"pattern":"^[0-9]{4}-[0-9]{2}-[0-9]{2}T[0-9]{2}:[0-9]{2}:[0-9]{2}Z$","type":"string"}},"required":["days","ended_at","started_at"],"type":"object"},"policy":{"additionalProperties":false,"properties":{"flake_ratio":{"additionalProperties":false,"properties":{"denominator":{"maximum":1000000,"minimum":1,"type":"integer"},"numerator":{"maximum":1000000,"minimum":0,"type":"integer"}},"required":["denominator","numerator"],"type":"object"},"max_age_seconds":{"maximum":604800,"minimum":1,"type":"integer"},"minimum_days":{"maximum":366,"minimum":7,"type":"integer"},"minimum_negative":{"maximum":2000,"minimum":5,"type":"integer"},"minimum_positive":{"maximum":2000,"minimum":5,"type":"integer"},"minimum_runs":{"maximum":1000000,"minimum":20,"type":"integer"},"runtime_ratio":{"additionalProperties":false,"properties":{"denominator":{"maximum":1000000,"minimum":1,"type":"integer"},"numerator":{"maximum":1000000,"minimum":0,"type":"integer"}},"required":["denominator","numerator"],"type":"object"}},"required":["flake_ratio","max_age_seconds","minimum_days","minimum_negative","minimum_positive","minimum_runs","runtime_ratio"],"type":"object"},"requested":{"enum":["retain","shadow","enforce"]},"rollback":{"additionalProperties":false,"properties":{"deadline":{"pattern":"^[0-9]{4}-[0-9]{2}-[0-9]{2}T[0-9]{2}:[0-9]{2}:[0-9]{2}Z$","type":"string"},"review":{"additionalProperties":false,"properties":{"approval_sha256":{"pattern":"^[0-9a-f]{64}$","type":"string"},"created_at":{"pattern":"^[0-9]{4}-[0-9]{2}-[0-9]{2}T[0-9]{2}:[0-9]{2}:[0-9]{2}Z$","type":"string"},"expires_at":{"pattern":"^[0-9]{4}-[0-9]{2}-[0-9]{2}T[0-9]{2}:[0-9]{2}:[0-9]{2}Z$","type":"string"},"owner":{"pattern":"^OWNER-[A-Z0-9]{4,32}$","type":"string"},"reviewer":{"pattern":"^OWNER-[A-Z0-9]{4,32}$","type":"string"}},"required":["approval_sha256","created_at","expires_at","owner","reviewer"],"type":"object"},"triggers":{"items":{"enum":["false-negative","unreviewed-mismatch","runtime-budget","flake-budget"]},"maxItems":4,"minItems":1,"type":"array"}},"required":["deadline","review","triggers"],"type":"object"}},"required":["awq_definition_sha256","cases","false_positive_reviews","id","native_definition_sha256","observation","policy","requested","rollback"],"type":"object"},"maxItems":200,"minItems":1,"type":"array"},"schema_version":{"const":1},"source_commit":{"pattern":"^[0-9a-f]{40}$","type":"string"}},"required":["consumer_sha256","gates","schema_version","source_commit"],"title":"AWQ consumer equivalence evidence v1","type":"object"}
