{"consumer_sha256":"cccccccccccccccccccccccccccccccccccccccccccccccccccccccccccccccc","gates":[{"awq_definition_sha256":"bbbbbbbbbbbbbbbbbbbbbbbbbbbbbbbbbbbbbbbbbbbbbbbbbbbbbbbbbbbbbbbb","cases":[{"awq":"pass","expected":"pass","native":"pass","sha256":"3764973d71c8bb5ec6fad3646c7a1cef49a7847c61688ae9e76ca36ce0d64b47"},{"awq":"pass","expected":"pass","native":"pass","sha256":"3f968e53b5145e9d912e2c9f06faa280f6e5a3436f719fe8f45b922e77fa7d75"},{"awq":"pass","expected":"pass","native":"pass","sha256":"4852c1bd54db3d04ea288728995c9c31a59a4496e273dbd031f263ff2803b693"},{"awq":"fail","expected":"fail","native":"fail","sha256":"4b038c1a8c3e6e84b5d3e9dae31e2022ae71428319f4b6869a85d7b3db478ad6"},{"awq":"pass","expected":"pass","native":"pass","sha256":"50306d14d0f5e9c7d46730fcc1c188a75f26f35dfb4ba848a79c01e7aada390d"},{"awq":"fail","expected":"fail","native":"fail","sha256":"87d7ce9e55cebb3149fe2c913bd57d7f58bea95933d488f4d68e45666101c84c"},{"awq":"pass","expected":"pass","native":"pass","sha256":"a754e6a60e3348b06516b1d553d884a4c1b46293a27978c9c98890008827e505"},{"awq":"fail","expected":"fail","native":"fail","sha256":"b9157daab1d166b03a3765cdf7a66387a2d00f0ec0728d5a397938e6cda10a39"},{"awq":"fail","expected":"fail","native":"fail","sha256":"c2677bc463195cb04cfab7bf9c199b38794eec9d7ff0b26f8d5dea4dc053e26e"},{"awq":"fail","expected":"fail","native":"fail","sha256":"e60d7628b4e2cce792475b0fed6aa94d18051c47bb8c57846bde521ce4cbcf48"}],"false_positive_reviews":[],"id":"AWQ-CORE-001","native_definition_sha256":"aaaaaaaaaaaaaaaaaaaaaaaaaaaaaaaaaaaaaaaaaaaaaaaaaaaaaaaaaaaaaaaa","observation":{"days":[{"awq_ms":120,"counts":{"both_fail":0,"both_pass":10,"false_negative":0,"false_positive":0,"inconclusive":0},"date":"2026-09-01","flaky_runs":0,"native_ms":100},{"awq_ms":120,"counts":{"both_fail":0,"both_pass":10,"false_negative":0,"false_positive":0,"inconclusive":0},"date":"2026-09-02","flaky_runs":0,"native_ms":100},{"awq_ms":120,"counts":{"both_fail":0,"both_pass":10,"false_negative":0,"false_positive":0,"inconclusive":0},"date":"2026-09-03","flaky_runs":0,"native_ms":100},{"awq_ms":120,"counts":{"both_fail":0,"both_pass":10,"false_negative":0,"false_positive":0,"inconclusive":0},"date":"2026-09-04","flaky_runs":0,"native_ms":100},{"awq_ms":120,"counts":{"both_fail":0,"both_pass":10,"false_negative":0,"false_positive":0,"inconclusive":0},"date":"2026-09-05","flaky_runs":0,"native_ms":100},{"awq_ms":120,"counts":{"both_fail":0,"both_pass":10,"false_negative":0,"false_positive":0,"inconclusive":0},"date":"2026-09-06","flaky_runs":0,"native_ms":100},{"awq_ms":120,"counts":{"both_fail":0,"both_pass":10,"false_negative":0,"false_positive":0,"inconclusive":0},"date":"2026-09-07","flaky_runs":0,"native_ms":100}],"ended_at":"2026-09-08T00:00:00Z","started_at":"2026-09-01T00:00:00Z"},"policy":{"flake_ratio":{"denominator":1,"numerator":0},"max_age_seconds":604800,"minimum_days":7,"minimum_negative":5,"minimum_positive":5,"minimum_runs":20,"runtime_ratio":{"denominator":1,"numerator":2}},"requested":"enforce","rollback":{"deadline":"2026-09-30T00:00:00Z","review":{"approval_sha256":"dddddddddddddddddddddddddddddddddddddddddddddddddddddddddddddddd","created_at":"2026-09-01T00:00:00Z","expires_at":"2026-10-01T00:00:00Z","owner":"OWNER-MAINTAINER","reviewer":"OWNER-REVIEWER"},"triggers":["false-negative","flake-budget","runtime-budget","unreviewed-mismatch"]}}],"schema_version":1,"source_commit":"eeeeeeeeeeeeeeeeeeeeeeeeeeeeeeeeeeeeeeee"}
